17:39:47.227876 IP 203.0.113.1.news > 192.0.2.2.ssh: Flags [S], seq 0:30, win 8192, length 30
17:39:47.228002 IP 192.0.2.2.ssh > 203.0.113.1.news: Flags [S.], seq 2574931173, ack 1, win 29200, options [mss 1460], length 0
17:39:47.233461 IP 203.0.113.1.news > 192.0.2.2.ssh: Flags [.], ack 1, win 29200, length 0
17:39:47.252968 IP 192.0.2.2.ssh > 203.0.113.1.news: Flags [P.], seq 1:22, ack 1, win 29200, length 21
17:39:47.259759 IP 203.0.113.1.news > 192.0.2.2.ssh: Flags [.], ack 1, win 29200, length 0
17:39:47.259859 IP 192.0.2.2.ssh > 203.0.113.1.news: Flags [.], ack 1, win 29200, length 0
17:39:47.457995 IP 192.0.2.2.ssh > 203.0.113.1.news: Flags [P.], seq 1:22, ack 1, win 29200, length 21
17:39:47.464462 IP 203.0.113.1.news > 192.0.2.2.ssh: Flags [.], ack 1, win 29200, length 0
17:39:47.868954 IP 192.0.2.2.ssh > 203.0.113.1.news: Flags [P.], seq 1:22, ack 1, win 29200, length 21
17:39:47.878894 IP 203.0.113.1.news > 192.0.2.2.ssh: Flags [.], ack 1, win 29200, length 0
17:39:47.878948 IP 192.0.2.2.ssh > 203.0.113.1.news: Flags [.], ack 1, win 29200, length 0
17:39:48.690011 IP 192.0.2.2.ssh > 203.0.113.1.news: Flags [P.], seq 1:22, ack 1, win 29200, length 21
17:39:48.694656 IP 203.0.113.1.news > 192.0.2.2.ssh: Flags [.], ack 1, win 29200, length 0
17:39:48.694711 IP 192.0.2.2.ssh > 203.0.113.1.news: Flags [.], ack 1, win 29200, length 0
17:39:50.333840 IP 192.0.2.2.ssh > 203.0.113.1.news: Flags [P.], seq 1:22, ack 1, win 29200, length 21
17:39:50.339054 IP 203.0.113.1.news > 192.0.2.2.ssh: Flags [.], ack 1, win 29200, length 0
17:39:50.339112 IP 192.0.2.2.ssh > 203.0.113.1.news: Flags [.], ack 1, win 29200, length 0
17:39:53.621955 IP 192.0.2.2.ssh > 203.0.113.1.news: Flags [P.], seq 1:22, ack 1, win 29200, length 21
17:39:53.626382 IP 203.0.113.1.news > 192.0.2.2.ssh: Flags [.], ack 1, win 29200, length 0
17:39:53.626435 IP 192.0.2.2.ssh > 203.0.113.1.news: Flags [.], ack 1, win 29200, length 0
17:40:00.197876 IP 192.0.2.2.ssh > 203.0.113.1.news: Flags [P.], seq 1:22, ack 1, win 29200, length 21